{
  "allowed_paths": [
    ".hermes/task-scope-contract.json",
    "ACCEPTANCE_CONTRACT.yaml",
    "SHA256SUMS",
    "factory/canary_faults.py",
    "factory/canary_qualification.py",
    "factory/config.py",
    "factory/functional_readiness.py",
    "factory/pre_q8_convergence.py",
    "factory/pre_q8_fixture.py",
    "factory/pre_q8_runtime.py",
    "factory/pre_q8_seal.py",
    "factory/support_bundle.py",
    "scripts/bootstrap/build-canary-configs.py",
    "scripts/bootstrap/build-qualification-config.py",
    "scripts/bootstrap/prepare-candidate-plane.sh",
    "scripts/canary_candidate.py",
    "scripts/functional_qualification.py",
    "scripts/pre_q8_convergence.py",
    "scripts/pre_q8_fixture.py",
    "scripts/pre_q8_runtime.py",
    "scripts/support_bundle.py",
    "scripts/task_scope_guard.py",
    "scripts/qualification/reconcile-functional.sh",
    "scripts/qualification/run-all-pre-q8.sh",
    "scripts/qualification/run-clean-canary.sh",
    "scripts/qualification/run-pre-q8-convergence-scenario.sh",
    "scripts/qualification/run-pre-q8-convergence.sh",
    "scripts/qualification/run-pre-q8-scenario.sh",
    "config/systemd/hermes-factory-pre-q8*.service",
    "config/systemd/hermes-factory-support-bundle@.service",
    "schemas/pre-q8-*.schema.json",
    "tests/test_clean_canary_runtime.py",
    "tests/test_error_free_process.py",
    "tests/test_pre_q8_convergence.py",
    "tests/test_pre_q8_runtime.py",
    "tests/test_pre_q8_systemd_harness.py",
    "tests/test_working_factory.py",
    "tools/preq8_final_assert.py",
    "tools/preq8_static_audit.py",
    "tools/vps_pre_q8_readonly_audit.sh"
  ],
  "approval_evidence_digest": "c3247d9279b318645ed5215c7646a9e91766626a6a2e1ad7bb882907b5fef18b",
  "approval_evidence_ref": "artifact://user-provided-fix-kit/c3247d9279b318645ed5215c7646a9e91766626a6a2e1ad7bb882907b5fef18b",
  "approved_by": "desktop-bootstrap",
  "branch": "agent/preq8-10of10-convergence",
  "contract_digest": "7654254ff2ccd6fc5c36bc59b5a5fc0480f5225d24dd8b02712c3d80ddae3cb5",
  "contract_id": "hermes-preq8-10of10-20260810",
  "created_at": "2026-08-10T05:25:00+00:00",
  "expires_at": "2026-09-09T05:25:00+00:00",
  "forbidden_paths": [
    ".git/**",
    ".github/**",
    "audit_output/**",
    "audit_tools/**",
    ".deployment/**",
    "config/factory-config.example.yaml",
    "config/credentials/**",
    "policies/**",
    "factory/state.py",
    "factory/migrations.py",
    "factory/credential_broker.py",
    "factory/gateway.py",
    "factory/telegram.py"
  ],
  "max_additions": 18000,
  "max_changed_files": 50,
  "max_deletions": 6000,
  "original_goal_digest": "031b0f3414532cb26781bb6637ae0f456c94a5270aeaca7c852e13b29bce6497",
  "parent_contract_digest": "d5d9df2eb137d8c1f201cd29c5f9ebb9d827564303f5fc063c4ec3bebe2245ab",
  "product_id": "hermes-software-factory",
  "rationale": "Implement the complete PRE-Q8 convergence, signed-seal admission, typed worker liveness, durable official failure terminalization, epoch and external-resource isolation, deterministic evidence, Q8 config-path validation, support evidence, and all mandatory tests from the user-supplied acceptance contract without changing Stable A or weakening quality gates.",
  "schema_version": "1.0",
  "task_id": "preq8-10of10-convergence",
  "trusted_base_sha": "8b717ad0204bd258fb1677f017123a8a971f57e2"
}
